Enter password: ****
Welcome to the MySQL monitor.  Commands end with ; or \g.
Your MySQL connection id is 9
Server version: 8.0.31 MySQL Community Server - GPL

Copyright (c) 2000, 2022, Oracle and/or its affiliates.

Oracle is a registered trademark of Oracle Corporation and/or its
affiliates. Other names may be trademarks of their respective
owners.

Type 'help;' or '\h' for help. Type '\c' to clear the current input statement.

mysql> show databases;
+--------------------+
| Database           |
+--------------------+
| information_schema |
| mydb               |
| mysql              |
| performance_schema |
| sys                |
+--------------------+
5 rows in set (0.01 sec)

mysql> show mydb;
ERROR 1064 (42000): You have an error in your SQL syntax; check the manual that corresponds to your MySQL server version for the right syntax to use near 'mydb' at line 1
mysql> use mydb;
Database changed
mysql> select * from mydb;
ERROR 1146 (42S02): Table 'mydb.mydb' doesn't exist
mysql> show tables;
+----------------+
| Tables_in_mydb |
+----------------+
| department     |
| employee       |
| marksheet      |
+----------------+
3 rows in set (0.00 sec)

mysql> create table from mydbl;
ERROR 1064 (42000): You have an error in your SQL syntax; check the manual that corresponds to your MySQL server version for the right syntax to use near 'from mydbl' at line 1
mysql> create table Student in database;
ERROR 1064 (42000): You have an error in your SQL syntax; check the manual that corresponds to your MySQL server version for the right syntax to use near 'in database' at line 1
mysql> use mydb;
Database changed
mysql> select * from marksheet;
+--------+----------------+---------+-----------+------+
| RollNo | Name           | physics | chemistry | math |
+--------+----------------+---------+-----------+------+
|      1 | Ankit Rawat    |      99 |        76 |   89 |
|      2 | Priya Sharma   |      85 |        88 |   92 |
|      3 | Rahul Verma    |      76 |        81 |   84 |
|      4 | Sneha Singh    |      90 |        78 |   93 |
|      5 | Amit Chauhan   |      68 |        72 |   75 |
|      6 | Ruchi Patel    |      83 |        69 |   80 |
|      7 | Kunal Joshi    |      74 |        94 |   88 |
|      8 | Diksha Gupta   |      66 |        86 |   96 |
|      9 | Prashant Mehra |      68 |        62 |   72 |
|     10 | Kanchan Kaur   |      76 |        72 |   76 |
|     11 | Mrinal Sen     |      74 |        68 |   76 |
|     12 | Lucky Kachera  |      88 |        89 |   96 |
+--------+----------------+---------+-----------+------+
12 rows in set (0.02 sec)

mysql> select * from marksheet where name = 'Ankit';
Empty set (0.00 sec)

mysql> select * from marksheet where name = 'Ankit Rawat';
+--------+-------------+---------+-----------+------+
| RollNo | Name        | physics | chemistry | math |
+--------+-------------+---------+-----------+------+
|      1 | Ankit Rawat |      99 |        76 |   89 |
+--------+-------------+---------+-----------+------+
1 row in set (0.00 sec)

mysql> use mydb;
Database changed
mysql> select * from employee;
+----+--------+-----------+--------+--------+
| id | name   | company   | salary | DeptId |
+----+--------+-----------+--------+--------+
|  1 | Ankit  | Tencent   | 699999 |      5 |
|  2 | Lucky  | MicroSoft | 699998 |      1 |
|  3 | Amit   | NVIDIA    | 699997 |      3 |
|  4 | Anshul | JP MORGAN | 699996 |   NULL |
|  5 | Priya  | Google    | 699995 |   NULL |
|  6 | Rahul  | Apple     | 699994 |   NULL |
|  7 | Sneha  | Amazon    | 699993 |   NULL |
|  8 | Mitesh | Facebook  | 699992 |   NULL |
|  9 | Divya  | IBM       | 699991 |      4 |
| 10 | Rohan  | Adobe     | 699990 |   NULL |
| 11 | Meena  | Oracle    | 699989 |   NULL |
| 12 | Arjun  | IBM       | 699988 |   NULL |
| 13 | Kavita | Intel     | 699987 |   NULL |
| 14 | Suresh | Cisco     | 699986 |   NULL |
+----+--------+-----------+--------+--------+
14 rows in set (0.00 sec)

mysql> select * from employee left join department on employee.deptid = department.id where employee.deptid is null union select * from employee right join department on employee.deptid where department.id is null;
+------+--------+-----------+--------+--------+------+------------+
| id   | name   | company   | salary | DeptId | id   | department |
+------+--------+-----------+--------+--------+------+------------+
|    4 | Anshul | JP MORGAN | 699996 |   NULL | NULL | NULL       |
|    5 | Priya  | Google    | 699995 |   NULL | NULL | NULL       |
|    6 | Rahul  | Apple     | 699994 |   NULL | NULL | NULL       |
|    7 | Sneha  | Amazon    | 699993 |   NULL | NULL | NULL       |
|    8 | Mitesh | Facebook  | 699992 |   NULL | NULL | NULL       |
|   10 | Rohan  | Adobe     | 699990 |   NULL | NULL | NULL       |
|   11 | Meena  | Oracle    | 699989 |   NULL | NULL | NULL       |
|   12 | Arjun  | IBM       | 699988 |   NULL | NULL | NULL       |
|   13 | Kavita | Intel     | 699987 |   NULL | NULL | NULL       |
|   14 | Suresh | Cisco     | 699986 |   NULL | NULL | NULL       |
+------+--------+-----------+--------+--------+------+------------+
10 rows in set (0.00 sec)

mysql> select * from employee left join department on employee.deptid =department.id where employee.deptid is null union select * from employee right join department on employee.deptid where department.id is null;
+------+--------+-----------+--------+--------+------+------------+
| id   | name   | company   | salary | DeptId | id   | department |
+------+--------+-----------+--------+--------+------+------------+
|    4 | Anshul | JP MORGAN | 699996 |   NULL | NULL | NULL       |
|    5 | Priya  | Google    | 699995 |   NULL | NULL | NULL       |
|    6 | Rahul  | Apple     | 699994 |   NULL | NULL | NULL       |
|    7 | Sneha  | Amazon    | 699993 |   NULL | NULL | NULL       |
|    8 | Mitesh | Facebook  | 699992 |   NULL | NULL | NULL       |
|   10 | Rohan  | Adobe     | 699990 |   NULL | NULL | NULL       |
|   11 | Meena  | Oracle    | 699989 |   NULL | NULL | NULL       |
|   12 | Arjun  | IBM       | 699988 |   NULL | NULL | NULL       |
|   13 | Kavita | Intel     | 699987 |   NULL | NULL | NULL       |
|   14 | Suresh | Cisco     | 699986 |   NULL | NULL | NULL       |
+------+--------+-----------+--------+--------+------+------------+
10 rows in set (0.00 sec)

mysql> update employee set deptid = 2 where name = 'Anshul';
Query OK, 1 row affected (0.02 sec)
Rows matched: 1  Changed: 1  Warnings: 0

mysql> show table;
ERROR 1064 (42000): You have an error in your SQL syntax; check the manual that corresponds to your MySQL server version for the right syntax to use near '' at line 1
mysql> select * from employee;
+----+--------+-----------+--------+--------+
| id | name   | company   | salary | DeptId |
+----+--------+-----------+--------+--------+
|  1 | Ankit  | Tencent   | 699999 |      5 |
|  2 | Lucky  | MicroSoft | 699998 |      1 |
|  3 | Amit   | NVIDIA    | 699997 |      3 |
|  4 | Anshul | JP MORGAN | 699996 |      2 |
|  5 | Priya  | Google    | 699995 |   NULL |
|  6 | Rahul  | Apple     | 699994 |   NULL |
|  7 | Sneha  | Amazon    | 699993 |   NULL |
|  8 | Mitesh | Facebook  | 699992 |   NULL |
|  9 | Divya  | IBM       | 699991 |      4 |
| 10 | Rohan  | Adobe     | 699990 |   NULL |
| 11 | Meena  | Oracle    | 699989 |   NULL |
| 12 | Arjun  | IBM       | 699988 |   NULL |
| 13 | Kavita | Intel     | 699987 |   NULL |
| 14 | Suresh | Cisco     | 699986 |   NULL |
+----+--------+-----------+--------+--------+
14 rows in set (0.00 sec)

mysql> select * from employee left join department on employee.deptid = department.id;
+----+--------+-----------+--------+--------+------+------------+
| id | name   | company   | salary | DeptId | id   | department |
+----+--------+-----------+--------+--------+------+------------+
|  1 | Ankit  | Tencent   | 699999 |      5 |    5 | Admin      |
|  2 | Lucky  | MicroSoft | 699998 |      1 |    1 | Developer  |
|  3 | Amit   | NVIDIA    | 699997 |      3 |    3 | Account    |
|  4 | Anshul | JP MORGAN | 699996 |      2 |    2 | HR         |
|  5 | Priya  | Google    | 699995 |   NULL | NULL | NULL       |
|  6 | Rahul  | Apple     | 699994 |   NULL | NULL | NULL       |
|  7 | Sneha  | Amazon    | 699993 |   NULL | NULL | NULL       |
|  8 | Mitesh | Facebook  | 699992 |   NULL | NULL | NULL       |
|  9 | Divya  | IBM       | 699991 |      4 |    4 | Finance    |
| 10 | Rohan  | Adobe     | 699990 |   NULL | NULL | NULL       |
| 11 | Meena  | Oracle    | 699989 |   NULL | NULL | NULL       |
| 12 | Arjun  | IBM       | 699988 |   NULL | NULL | NULL       |
| 13 | Kavita | Intel     | 699987 |   NULL | NULL | NULL       |
| 14 | Suresh | Cisco     | 699986 |   NULL | NULL | NULL       |
+----+--------+-----------+--------+--------+------+------------+
14 rows in set (0.00 sec)

mysql> select * from employee right join department on employee.deptid = department.id;
+------+--------+-----------+--------+--------+----+------------+
| id   | name   | company   | salary | DeptId | id | department |
+------+--------+-----------+--------+--------+----+------------+
|    2 | Lucky  | MicroSoft | 699998 |      1 |  1 | Developer  |
|    4 | Anshul | JP MORGAN | 699996 |      2 |  2 | HR         |
|    3 | Amit   | NVIDIA    | 699997 |      3 |  3 | Account    |
|    9 | Divya  | IBM       | 699991 |      4 |  4 | Finance    |
|    1 | Ankit  | Tencent   | 699999 |      5 |  5 | Admin      |
+------+--------+-----------+--------+--------+----+------------+
5 rows in set (0.00 sec)

mysql> select * from employee right join department on employee.deptid = department.id asc;
ERROR 1064 (42000): You have an error in your SQL syntax; check the manual that corresponds to your MySQL server version for the right syntax to use near 'asc' at line 1
mysql> select * from employee right join department on employee.deptid = department.id order by asc;
ERROR 1064 (42000): You have an error in your SQL syntax; check the manual that corresponds to your MySQL server version for the right syntax to use near 'asc' at line 1
mysql> select * from employee right join department on employee.deptid = department.id order by Desc;
ERROR 1064 (42000): You have an error in your SQL syntax; check the manual that corresponds to your MySQL server version for the right syntax to use near 'Desc' at line 1
mysql> select * from employee inner  join department on employee.deptid = department.id;
+----+--------+-----------+--------+--------+----+------------+
| id | name   | company   | salary | DeptId | id | department |
+----+--------+-----------+--------+--------+----+------------+
|  2 | Lucky  | MicroSoft | 699998 |      1 |  1 | Developer  |
|  4 | Anshul | JP MORGAN | 699996 |      2 |  2 | HR         |
|  3 | Amit   | NVIDIA    | 699997 |      3 |  3 | Account    |
|  9 | Divya  | IBM       | 699991 |      4 |  4 | Finance    |
|  1 | Ankit  | Tencent   | 699999 |      5 |  5 | Admin      |
+----+--------+-----------+--------+--------+----+------------+
5 rows in set (0.00 sec)

mysql> select * from employee outer  join department on employee.deptid = department.id;
ERROR 1064 (42000): You have an error in your SQL syntax; check the manual that corresponds to your MySQL server version for the right syntax to use near 'outer  join department on employee.deptid = department.id' at line 1
mysql> select * from employee left  join department on employee.deptid = department.id where employee.deptid is null union select * from employee right join department on employee.deptid where department.id is null;
+------+--------+----------+--------+--------+------+------------+
| id   | name   | company  | salary | DeptId | id   | department |
+------+--------+----------+--------+--------+------+------------+
|    5 | Priya  | Google   | 699995 |   NULL | NULL | NULL       |
|    6 | Rahul  | Apple    | 699994 |   NULL | NULL | NULL       |
|    7 | Sneha  | Amazon   | 699993 |   NULL | NULL | NULL       |
|    8 | Mitesh | Facebook | 699992 |   NULL | NULL | NULL       |
|   10 | Rohan  | Adobe    | 699990 |   NULL | NULL | NULL       |
|   11 | Meena  | Oracle   | 699989 |   NULL | NULL | NULL       |
|   12 | Arjun  | IBM      | 699988 |   NULL | NULL | NULL       |
|   13 | Kavita | Intel    | 699987 |   NULL | NULL | NULL       |
|   14 | Suresh | Cisco    | 699986 |   NULL | NULL | NULL       |
+------+--------+----------+--------+--------+------+------------+
9 rows in set (0.00 sec)

mysql>